{
  "schema_version": 1,
  "route_key": "acme/api/products",
  "role": "responder",
  "version": "v1",
  "status": "production",
  "base_model": {
    "id": "Qwen/Qwen2.5-Coder-1.5B-Instruct",
    "family": "Qwen/Qwen2.5-Coder-1.5B-Instruct",
    "vendor": "Qwen"
  },
  "adapter": {
    "format": "peft-lora",
    "path": "/path/to/models/adapters/Qwen/Qwen2.5-Coder-1.5B-Instruct/acme/api/products/responder/v1",
    "source": "local"
  },
  "training": {
    "dataset": "synthesized endpoint data",
    "dataset_version": "2026-01-01"
  },
  "evaluation": {
    "type": "holdout",
    "primary_metric": "average_similarity",
    "primary_score": 0.95
  },
  "created_at": "2026-01-01T00:00:00Z",
  "notes": "Example responder manifest."
}
